Human_Content,AI_Content
So my boyfriend moved in with me about 2 months ago,He restarted the computer twice.
My fiancee broke her leg :(,The website loaded within seconds.
So my boyfriend moved in with me about 2 months ago,I saved the document on the cloud.
Everyone dies in the end.,The camera captured sharp images.
So my boyfriend moved in with me about 2 months ago,She muted the microphone during the call.
Does your boyfriend know you have a dick?,He downloaded the file securely.
Pretty sure he figured that out,The smartwatch tracked his steps.
What's your favorite country other than your own?,I enabled dark mode on the screen.
What's your favorite country other than your own?,The tablet synced with the account.
"smh my country is one of my least favorite.

Spain is probably my favorite.",She scanned the QR code quickly.
What's your favorite country other than your own?,He adjusted the brightness level.
That feeling when you don't see your own country in the comments :(,The speaker produced clear sound.
My girlfriend is on a date with my oldest son and I couldn't be happier!!!,I backed up the photos yesterday.
The title makes t sounds like they are literally dating,She laughed at the funny joke.
The title makes t sounds like they are literally dating,He frowned when he heard the news.
I guess I kind of assumed people would get what I meant.,I felt nervous before the interview.
Dude this is reddit. People will hunt and skin you for a minor spelling mistake,The child cried softly.
Or break your hands? ,She hugged her friend tightly.
I guess I kind of assumed people would get what I meant.,He smiled with relief.
Dude this is reddit. People will hunt and skin you for a minor spelling mistake,I felt proud of my achievement.
YOU FORGOT THE PERIOD AT THE END OF YOUR SENTENCE.  PREPARE YOUR ANUS.,The teacher encouraged the students.
"You wrote in all capitals, and have no exclamation marks! Prepare your anus!",She whispered a secret.
Dude this is reddit. People will hunt and skin you for a minor spelling mistake,He shouted across the street.
YOU FORGOT THE PERIOD AT THE END OF YOUR SENTENCE.  PREPARE YOUR ANUS.,I felt calm near the ocean.
I guess I kind of assumed people would get what I meant.,The baby giggled happily.
I guess I kind of assumed people would get what I meant.,She looked worried about the exam.
The title makes t sounds like they are literally dating,He sighed with disappointment.
The title makes t sounds like they are literally dating,I felt grateful for the support.
The title makes t sounds like they are literally dating,The crowd cheered loudly.
The title makes t sounds like they are literally dating,She blushed when complimented.
My girlfriend is on a date with my oldest son and I couldn't be happier!!!,He nodded in agreement.
The title makes t sounds like they are literally dating,I felt inspired by the speech.
I still don't get it. What's OP trying to say?,The group celebrated together.
His girlfriends and son are bonding ,The sun rose behind the mountains.
i need to do a homework and i don't know how :I ,The river flowed gently.
I had an amazing day yesterday :),The wind rustled through the trees.
That's awesome glad you are happyðŸ˜€ðŸ˜Šâ˜º,The flowers bloomed in spring.
I had an amazing day yesterday :),The snow covered the rooftops.
"Wait,shit!",The birds chirped at dawn.
When's the last time you are a whole bag of chips in one sitting?,The leaves turned golden in autumn.
Haha. Probably like 2 weeks ago!,The storm passed quickly.
Leave a banana in front of your neighbors door and take a picture of it,The waves crashed against the rocks.
I don't have a banana :( ,The grass grew taller after the rain.
Any small fruit/vegetable,The sky turned orange at sunset.
"Is there any object or possession that you still have,  since you've been a child?",The forest was dense and green.
I still have the very same stuffed animal that my parents were gifted after my birth.,The clouds drifted slowly.
I dare you to kill 7 1/2 people,The desert stretched endlessly.
"Where can I find half a person, let alone seven of them?",The rainwater filled the pond.
Hey man that's your problem,The stars twinkled at night.
What is your favorite type of pepperoni pizza?,The soil smelled fresh after rain.
Chiruo,The mountain peak was covered in mist.
tell us your darkest sexual fantasy. that's a daring truth if i ever saw one.,The valley echoed with silence.
Dying during autoerotic asphyxiation,The horizon looked infinite.
"ohh, that's a dark one!",The soup tasted warm and spicy.
Have you ever experimented with drugs?,She baked cookies with chocolate chips.
"No, unless we count antidepressants.",He sliced the bread evenly.
what question do you secretly wish that someone asks you? ,I brewed tea with ginger.
"How I'm doing, I guess? I think I'm a little too lonely for my own good.",The salad was fresh and crisp.
How *are* you doing?,She poured juice into the glass.
Post a picture of a catapult on r/trebuchetmemes saying it's the best siege weapon of all,He grilled the chicken perfectly.
"&gt;  the best siege weapon of all,done, go check it out",I added sugar to the coffee.
You monster!,The pizza was topped with olives.
What is your credit card number?,She stirred the sauce slowly.
Booo,He peeled the orange carefully.
"If you were given a clone, just showed up at your door, what would you do? ",I served rice with curry.
Learn to dance ,The cake was decorated with cream.
I can dance! Maybe a new step?,She fried the vegetables lightly.
I dare you to breath!,He tasted the dish before serving.
Shit I have asthma ,I packed lunch in a box.
you had one job...,The sandwich had extra cheese.
Did you just blink?,She boiled the eggs for breakfast.
Yes! That was easy.,He ordered dessert after dinner.
Nice!,I enjoyed the meal thoroughly.
Pluck a pube.,The doorbell rang unexpectedly.
Done. Not fun doing it but a dare is a dare,She folded the umbrella after the rain.
Truth or Dare?,He polished his shoes before leaving.
"Dare
",I cleaned the mirror carefully.
Found the introvert. ,The fan rotated slowly.
"He's not a good enough introvert. You'll never find _me_, though!

&amp;nbsp",She arranged flowers in a vase.
"Hello there, do you know how the crazy sharks became normal again? ",
The wat? ,He tied his shoelaces tightly.
"With electro-sharp therapy. Haha, sorry for shark joke. What's up buddy? ",
"Nothing so far, trying to get some worldbuilding ideas. ",I switched off the lights.
Not much of a gamer but Overwatch is awesome. ,
Try Bloodborn! Or Uncharted (Trilogy and the new one) and defenitly The Last of Us Remaster,The cat slept on the couch.
Uncharted for sure. Perhaps the least regrettable $90 I've ever spent on video games.,
Hey,
Hi,
Why are you feeling lonely ? ,
Well then I guess we need to help each other lol. ,
"Oh boy.

How can I help?",
Find a girl for me to ask out lol ,
"Oh, haha, I didn't catch that sorry.

Aww :(",
The usual. Like no wishing for more wishes or creating paradoxes of any kind.,
I wish for a new genie that will give me unlimited wishes.,
For everyone? :D,
"Yes, for everyone. No more debt.",
Hello Mr. Robot. ,
???,
Very well! World peace by sacrificing mass freedoms it is!,
The hell is a mass freedom?,
I had to Google crabcore. I've never heard of it before. ,
It's bands like Attack Attack! and stuff. Metalcore and post-hardcore,
That's nothing to be ashamed of!,
Oh I'm not but that's the closest I have to a guilty pleasure lol ,
why is it do hard :(,
Wanna know what else is so hard right now?,
maybe ;),
"You're bluffing, you filthy milk drinker!",
Haha I am bluffing BUT I do but drink milk.,
I'll be your friend bae. &lt;3,
Is this a joke? Are you being serious?,
Of course I am!,
OMG. Yes! Let's be friends!,
"Yay!

How do we do that?",
Uhhhh get to know each other?,
"We're bad at this. Haha.

Where are you from?",
"We really are. :(

USA, California. You?",
Also California. :D,
Hey! Nice to meet you fellow Californian!,
"Right on! What part are you in? I'm in Bakersfield. 

Don't judge me.",
"Los Angeles âœŒðŸ¼ï¸

Judge you for what?",
"Being from Bakersfield. Man we're just a couple hours away from each other! Small world, buddy.",
Hey! That's cool! (We're so bad at this ðŸ˜‚),
Do you have Kik?,
I only have Snapchat ,
"That works, what's the name",
"To be fair, this is CC, we're special internet people. ",
Word up homie,
What was all that nonsense?,
It's snowing where I am and this makes me very happy.,
Lucky!! Send some my way plz,
Aw thank you ,
*I like your username*,
Thank you ,
OMG! Stay inside!,
"Can't. School, clinicals, work. :(",
Wouldn't they be octocles?,
Only if they're connected.,
Important side question: is phoenix wright any good?,
I actually haven't played but a friend who did said it was!,
"Just visit, or would you watch a game in each to consider it done?",
Want to see the Mets play in each stadium,
It's the whole apartment building! Lol,
Burn it. Burn it all.,
Tell your landlord. That drastically lowers property value.,
"Or he'll just say, ""weird, we spray for bugs every month"" and walk away... ",
"That's the most circle jerk thing I've ever heard. 
Wow.",
Seriously. I thought that was the whole point of that sub. ,
,
,
,
,
,
,
,
